{
  "items": [
    {
      "confidence": "high",
      "findingId": "RC-51D4CB4D14",
      "fingerprint": "51d4cb4d14b3be635436732befa259b96ac1c3e03ca25b0aad576adbdb375060",
      "remediation": {
        "summary": "Emit exactly one reviewed absolute canonical URL for this document.",
        "technicalHints": []
      },
      "reportAnchor": "report.html#RC-51D4CB4D14",
      "ruleId": "metadata-canonical",
      "scenarioId": "baseline",
      "severity": "major",
      "title": "Canonical link is missing, duplicated, or invalid",
      "translations": {
        "zh-CN": {
          "remediation": {
            "summary": "为当前文档输出恰好一个经过审核的绝对 canonical URL。",
            "technicalHints": []
          },
          "title": "Canonical 链接缺失、重复或无效"
        }
      },
      "verification": {
        "forbidSameLevelRegression": true,
        "requireFingerprintAbsent": true,
        "requireHealthyBaseline": true,
        "requiredScenarios": [
          "baseline"
        ]
      }
    },
    {
      "confidence": "high",
      "findingId": "RC-FC9B00B542",
      "fingerprint": "fc9b00b542ca40a5b89371b444fd009bb220be117efed73c09080da5ad109d60",
      "remediation": {
        "summary": "Add one accurate, page-specific meta description within the configured range; do not stuff keywords.",
        "technicalHints": []
      },
      "reportAnchor": "report.html#RC-FC9B00B542",
      "ruleId": "metadata-description-length",
      "scenarioId": "baseline",
      "severity": "major",
      "title": "Meta description does not meet the publishing policy",
      "translations": {
        "zh-CN": {
          "remediation": {
            "summary": "添加一个准确且针对当前页面的 meta description，并满足长度范围；不要堆砌关键词。",
            "technicalHints": []
          },
          "title": "Meta description 不符合发布策略"
        }
      },
      "verification": {
        "forbidSameLevelRegression": true,
        "requireFingerprintAbsent": true,
        "requireHealthyBaseline": true,
        "requiredScenarios": [
          "baseline"
        ]
      }
    },
    {
      "confidence": "high",
      "findingId": "RC-DE543A763E",
      "fingerprint": "de543a763eafa73004962921df1ace4e378a09b7fd698ff555bdb6f0e68610ef",
      "remediation": {
        "summary": "Keep one page-specific h1 and demote or consolidate competing top-level headings without hiding content.",
        "technicalHints": []
      },
      "reportAnchor": "report.html#RC-DE543A763E",
      "ruleId": "metadata-h1-count",
      "scenarioId": "baseline",
      "severity": "major",
      "title": "Page does not expose exactly one primary heading",
      "translations": {
        "zh-CN": {
          "remediation": {
            "summary": "保留一个针对当前页面的 h1，并在不隐藏内容的前提下降级或合并其他顶级标题。",
            "technicalHints": []
          },
          "title": "页面没有恰好一个主标题"
        }
      },
      "verification": {
        "forbidSameLevelRegression": true,
        "requireFingerprintAbsent": true,
        "requireHealthyBaseline": true,
        "requiredScenarios": [
          "baseline"
        ]
      }
    },
    {
      "confidence": "high",
      "findingId": "RC-BF5823BDC5",
      "fingerprint": "bf5823bdc5de281d1869a5cf635353a805287b7e8bfef1eb0798b9689348733f",
      "remediation": {
        "summary": "Remove noindex only after confirming this route is intended for public indexing and no equivalent header blocks it.",
        "technicalHints": []
      },
      "reportAnchor": "report.html#RC-BF5823BDC5",
      "ruleId": "metadata-robots-noindex",
      "scenarioId": "baseline",
      "severity": "major",
      "title": "Page is marked noindex against publishing policy",
      "translations": {
        "zh-CN": {
          "remediation": {
            "summary": "确认该路由确实用于公开索引且没有等效响应头阻止后，再移除 noindex。",
            "technicalHints": []
          },
          "title": "页面的 noindex 标记违反发布策略"
        }
      },
      "verification": {
        "forbidSameLevelRegression": true,
        "requireFingerprintAbsent": true,
        "requireHealthyBaseline": true,
        "requiredScenarios": [
          "baseline"
        ]
      }
    },
    {
      "confidence": "high",
      "findingId": "RC-4CA707B13D",
      "fingerprint": "4ca707b13d62458f10615a1c52ff22ba72d01da531cc4b32a073c24e4e28d609",
      "remediation": {
        "summary": "Provide one concise, page-specific title within the configured length range.",
        "technicalHints": []
      },
      "reportAnchor": "report.html#RC-4CA707B13D",
      "ruleId": "metadata-title-length",
      "scenarioId": "baseline",
      "severity": "major",
      "title": "Document title does not meet the publishing policy",
      "translations": {
        "zh-CN": {
          "remediation": {
            "summary": "提供一个简洁且针对当前页面的标题，并满足配置的长度范围。",
            "technicalHints": []
          },
          "title": "文档标题不符合发布策略"
        }
      },
      "verification": {
        "forbidSameLevelRegression": true,
        "requireFingerprintAbsent": true,
        "requireHealthyBaseline": true,
        "requiredScenarios": [
          "baseline"
        ]
      }
    },
    {
      "confidence": "high",
      "findingId": "RC-12B8E2C4B7",
      "fingerprint": "12b8e2c4b7dd6b8a137ed02738821d6f2df9c44fa80e57bf9de6ec2fa4fa33c1",
      "remediation": {
        "summary": "Provide one reviewed viewport declaration that includes width=device-width.",
        "technicalHints": []
      },
      "reportAnchor": "report.html#RC-12B8E2C4B7",
      "ruleId": "metadata-viewport",
      "scenarioId": "baseline",
      "severity": "major",
      "title": "Responsive viewport metadata is missing or ambiguous",
      "translations": {
        "zh-CN": {
          "remediation": {
            "summary": "提供一个包含 width=device-width 的、经过审核的 viewport 声明。",
            "technicalHints": []
          },
          "title": "响应式 viewport 元数据缺失或不明确"
        }
      },
      "verification": {
        "forbidSameLevelRegression": true,
        "requireFingerprintAbsent": true,
        "requireHealthyBaseline": true,
        "requiredScenarios": [
          "baseline"
        ]
      }
    },
    {
      "confidence": "high",
      "findingId": "RC-1121CA3B1F",
      "fingerprint": "1121ca3b1fc24733f2b458b80d56cbb3d1ccfebf3e8a4bf9b708d9488af5d604",
      "remediation": {
        "summary": "Declare the page's primary BCP 47 language tag on the root html element.",
        "technicalHints": [
          "Use a specific tag such as en, zh-CN, or ar and update it when the document language changes."
        ]
      },
      "reportAnchor": "report.html#RC-1121CA3B1F",
      "ruleId": "document-language-missing",
      "scenarioId": "baseline",
      "severity": "minor",
      "title": "The document does not declare its language",
      "translations": {
        "zh-CN": {
          "remediation": {
            "summary": "在根 html 元素上声明页面主要语言的 BCP 47 标签。",
            "technicalHints": [
              "使用 en、zh-CN 或 ar 等明确标签，并在文档语言变化时同步更新。"
            ]
          },
          "title": "文档没有声明语言"
        }
      },
      "verification": {
        "forbidSameLevelRegression": true,
        "requireFingerprintAbsent": true,
        "requireHealthyBaseline": true,
        "requiredScenarios": [
          "baseline"
        ]
      }
    }
  ],
  "kind": "repair-plan",
  "schemaVersion": "1",
  "source": {
    "reportPath": "report.json",
    "runId": "20260804T180133Z-00ac02",
    "target": "http://127.0.0.1:4182/examples/metadata-lab/broken.html"
  },
  "summary": {
    "critical": 0,
    "items": 7,
    "major": 6,
    "minor": 1,
    "reviewRequired": 0,
    "waived": 0
  },
  "toolVersion": "0.4.0"
}
